question;answer0;answer1;answer2;answer3;explanation
Welches Tier hält keinen Winterschlaf?;Dachs;Igel;Fledermaus;Murmeltier;Der Dachs hält nur Winterruhe, während Fledermäuse, Igel und Murmeltiere "richtigen" Winterschalf halten. Nur beim Winterschlaf fällt die Körpertemperatur unter 30°C und die Tiere schlafen komplett durch. Der Dachs und auch der Bär wachen während ihrer Winterruhe regelmäßig auf, wenn sie Hunger haben.
Welches ist ein Wintersternbild der Nordhalbkugel?;Orion;Schwan;Großer Wagen;Adler;Orion ist eines der bekanntesten Wintersternbilder und ist Mitte Dezember am besten zu sehen. Der "große Wagen" oder "Großer Bär" oder lateinisch "Ursa Major" ist eines der bekanntesten Sternbilder und ist ganzjährig sichtbar. Der Adler (lat. Aquila) ist ein markantes Sternbild des nördlichen Sommer- und Herbsthimmels. Der Schwan (lat. Cygnus) ist am Sommer- und Herbsthimmel zu sehen.
In der winterlichen Zeit ist Vitamin C ein wichtiger Bestandteil gegen Krankheiten. Was hat pro 100 g am meisten Vitamin C?;Brennnessel;Paprika;Orange;Petersilie;Brennnesseln haben mit bis zu 333 mg am meisten Vitamin C. Petersilie 160, Paprika 140, Orange 53. Die empfohlene Tageszufuhr beträgt 95-110 mg Vitamin C. Diese hat man schon mit einer Paprika gedeckt, da eine Parika ca. 125g wiegt. Oder alternativ mit ca. 30g Brennnesseln.
Was hängen US-Amerikaner an ihren Weihnachtsbaum im Glauben, es sei ein deutscher Brauch?;Gläserne Gurke;Brezel;Weisswurst;Autoschlüssel;Amerikaner lieben schrillen Weihnachtschmuck. Die Bäume in Wohnzimmern oder vor den Häusern sind mitunter derart kunterbunt beleuchtet, dass es Europäern in den Augen schmerzt. An manchen Bäumen gibt es eine Besonderheit, die geradezu bizarr anmutet: Da hängt eine saure Gurke, grün schillernd aus Glas oder Kunststoff hergestellt. „Christmas Pickle“ oder „Good Luck Pickle“ (Glücksgurke) nennen das die Amerikaner.
Wie schnell fuhr Simone Origone 2016 Ski und setzte dabei einen neuen Weltrekord?;252,4 km/h;181,5 km/h;122,2 km/h;89,6 km/h;Der Name Simone Origone dominiert die Speed Skiing-Szene seit Langem. Der 34-Jährige hat alles gewonnen, was es zu gewinnen gibt, und das mehrfach. Am 31. März 2016 stellte er im französischen Vars mit einem Tempo von 252,4 kmh einen neuen Weltrekord auf und überbot damit seinen eigenen Rekord von 2006.
Was braucht es in der Luft, damit sich Schnee bilden kann?;Kristallisations-keime;Samtfußrübling (Winterpilz);ionisierter Wasserdampf;elektrische Potentiale;Schnee entsteht, wenn sich in den Wolken feinste Tröpfchen unterkühlten Wassers an Kristallisationskeimen (zum Beispiel Staubteilchen) anlagern und dort gefrieren. Dieser Prozess setzt jedoch erst bei Temperaturen unter −12 °C ein. Wasser kann in Abwesenheit von Kristallisationsansätzen bei bis zu −48 °C flüssig bleiben.
Welcher Baum eignet sich am schlechtesten als Weihnachtsbaum?;Lärche;Stech-Fichte;Blau-Fichte;Rottanne;Die Lärche, ein nur im Sommer grüner Baum und verliert schon vor dem 1. Advent sämtliche Nadeln. Bis Ende der 1950er Jahre war die Rottanne bei weitem der beliebteste Weihnachtsbaum in Deutschland. In den 1960er-Jahren bis Mitte der 1970er-Jahre bevorzugten sie die dichter wachsende Stech-Fichte, auch Blau-Fichte genannt. Seit Anfang der 1980er-Jahre ist die Nordmanntanne in Deutschland am beliebtesten (80% alle Weihnachtsbäume im Jahr 2020).
Das Rentier ist die einzige Hirschart, die domestiziert wurde. Außerdem ist das Rentier die einzige Hirschart,;bei der Männchen und Weibchen ein Geweih tragen;bei der das Geweih nicht jährlich erneuert wird;die keine Gallenblase besitzt;die nicht teil Familie der Paarhufer ist;Rentiere sind die einzigen Hirsche, bei denen Männchen und Weibchen Geweihe tragen. Sie sind bei den Männchen allerdings deutlich größer. Allen Hirschen fehlt die Gallenblase und alle erneuern jährlich ihr Geweih. Hirsche sind eine der sechs lebenden Familien der Unterordnung der Wiederkäuer (Ruminantia) innerhalb der Ordnung der Paarhufer (Artiodactyla).